"No.","Time","Source","Destination","Protocol","Length","Info"
"1","0.000000000","Routerbo_1c:9f:51","Spanning-tree-(for-bridges)_00","STP","60","RST. Root = 32768/0/c4:ad:34:1c:9f:51  Cost = 0  Port = 0x0001"
"2","2.001730325","Routerbo_1c:9f:51","Spanning-tree-(for-bridges)_00","STP","60","RST. Root = 32768/0/c4:ad:34:1c:9f:51  Cost = 0  Port = 0x0001"
"3","4.004136101","Routerbo_1c:9f:51","Spanning-tree-(for-bridges)_00","STP","60","RST. Root = 32768/0/c4:ad:34:1c:9f:51  Cost = 0  Port = 0x0001"
"4","6.006258737","Routerbo_1c:9f:51","Spanning-tree-(for-bridges)_00","STP","60","RST. Root = 32768/0/c4:ad:34:1c:9f:51  Cost = 0  Port = 0x0001"
"5","7.253846026","172.16.30.1","172.16.1.10","TCP","74","45728  >  21 [SYN] Seq=0 Win=64240 Len=0 MSS=1460 SACK_PERM=1 TSval=1736416115 TSecr=0 WS=128"
"6","7.254378716","172.16.1.10","172.16.30.1","TCP","74","21  >  45728 [SYN, ACK] Seq=0 Ack=1 Win=65160 Len=0 MSS=1460 SACK_PERM=1 TSval=1153617091 TSecr=1736416115 WS=128"
"7","7.254406374","172.16.30.1","172.16.1.10","TCP","66","45728  >  21 [ACK] Seq=1 Ack=1 Win=64256 Len=0 TSval=1736416115 TSecr=1153617091"
"8","7.259184870","172.16.1.10","172.16.30.1","FTP","116","Response: 220 ProFTPD Server (Debian) [::ffff:172.16.1.10]"
"9","7.259197511","172.16.30.1","172.16.1.10","TCP","66","45728  >  21 [ACK] Seq=1 Ack=51 Win=64256 Len=0 TSval=1736416120 TSecr=1153617095"
"10","7.259279856","172.16.30.1","172.16.1.10","FTP","77","Request: USER rcom"
"11","7.259578573","172.16.1.10","172.16.30.1","TCP","66","21  >  45728 [ACK] Seq=51 Ack=12 Win=65280 Len=0 TSval=1153617096 TSecr=1736416120"
"12","7.260172794","172.16.1.10","172.16.30.1","FTP","98","Response: 331 Password required for rcom"
"13","7.260246828","172.16.30.1","172.16.1.10","FTP","77","Request: PASS rcom"
"14","7.304278020","172.16.1.10","172.16.30.1","TCP","66","21  >  45728 [ACK] Seq=83 Ack=23 Win=65280 Len=0 TSval=1153617141 TSecr=1736416121"
"15","7.436180090","172.16.1.10","172.16.30.1","FTP","112","Response: 230-Welcome, archive user rcom@172.16.1.31 !"
"16","7.436196992","172.16.1.10","172.16.30.1","FTP","69","Response:  "
"17","7.436205094","172.16.1.10","172.16.30.1","FTP","112","Response:  The local time is: Fri Dec 13 16:23:02 2024"
"18","7.436250212","172.16.1.10","172.16.30.1","FTP","69","Response:  "
"19","7.436294771","172.16.1.10","172.16.30.1","FTP","139","Response:  This is an experimental FTP server.  If you have any unusual problems,"
"20","7.436325013","172.16.1.10","172.16.30.1","FTP","129","Response:  please report them via e-mail to <root@ftp.netlab.fe.up.pt>."
"21","7.436383332","172.16.1.10","172.16.30.1","FTP","94","Response:  "
"22","7.436580079","172.16.30.1","172.16.1.10","TCP","66","45728  >  21 [ACK] Seq=23 Ack=345 Win=64128 Len=0 TSval=1736416297 TSecr=1153617272"
"23","7.436604594","172.16.30.1","172.16.1.10","FTP","72","Request: pasv"
"24","7.436940118","172.16.1.10","172.16.30.1","TCP","66","21  >  45728 [ACK] Seq=345 Ack=29 Win=65280 Len=0 TSval=1153617273 TSecr=1736416297"
"25","7.440952858","172.16.1.10","172.16.30.1","FTP","116","Response: 227 Entering Passive Mode (172,16,1,10,164,251)."
"26","7.441029476","172.16.30.1","172.16.1.10","TCP","74","41462  >  42235 [SYN] Seq=0 Win=64240 Len=0 MSS=1460 SACK_PERM=1 TSval=1736416302 TSecr=0 WS=128"
"27","7.441373451","172.16.1.10","172.16.30.1","TCP","74","42235  >  41462 [SYN, ACK] Seq=0 Ack=1 Win=65160 Len=0 MSS=1460 SACK_PERM=1 TSval=1153617278 TSecr=1736416302 WS=128"
"28","7.441393147","172.16.30.1","172.16.1.10","TCP","66","41462  >  42235 [ACK] Seq=1 Ack=1 Win=64256 Len=0 TSval=1736416302 TSecr=1153617278"
"29","7.441411376","172.16.30.1","172.16.1.10","FTP","82","Request: retr /pipe.txt"
"30","7.442355229","172.16.1.10","172.16.30.1","FTP","132","Response: 150 Opening ASCII mode data connection for /pipe.txt (418 bytes)"
"31","7.442586967","172.16.1.10","172.16.30.1","FTP-DATA","484","FTP Data: 418 bytes (PASV) (retr /pipe.txt)"
"32","7.442599609","172.16.30.1","172.16.1.10","TCP","66","41462  >  42235 [ACK] Seq=1 Ack=419 Win=64128 Len=0 TSval=1736416303 TSecr=1153617279"
"33","7.442606523","172.16.1.10","172.16.30.1","TCP","66","42235  >  41462 [FIN, ACK] Seq=419 Ack=1 Win=65280 Len=0 TSval=1153617279 TSecr=1736416302"
"34","7.442716037","172.16.30.1","172.16.1.10","TCP","66","41462  >  42235 [FIN, ACK] Seq=1 Ack=420 Win=64128 Len=0 TSval=1736416304 TSecr=1153617279"
"35","7.443008398","172.16.1.10","172.16.30.1","TCP","66","42235  >  41462 [ACK] Seq=420 Ack=2 Win=65280 Len=0 TSval=1153617279 TSecr=1736416304"
"36","7.443287559","172.16.1.10","172.16.30.1","FTP","89","Response: 226 Transfer complete"
"37","7.443340081","172.16.30.1","172.16.1.10","TCP","66","45728  >  21 [ACK] Seq=45 Ack=484 Win=64128 Len=0 TSval=1736416304 TSecr=1153617279"
"38","7.443370113","172.16.30.1","172.16.1.10","TCP","66","45728  >  21 [FIN, ACK] Seq=45 Ack=484 Win=64128 Len=0 TSval=1736416304 TSecr=1153617279"
"39","7.443798877","172.16.1.10","172.16.30.1","TCP","66","21  >  45728 [FIN, ACK] Seq=484 Ack=46 Win=65280 Len=0 TSval=1153617280 TSecr=1736416304"
"40","7.443819970","172.16.30.1","172.16.1.10","TCP","66","45728  >  21 [ACK] Seq=46 Ack=485 Win=64128 Len=0 TSval=1736416305 TSecr=1153617280"
"41","8.008346035","Routerbo_1c:9f:51","Spanning-tree-(for-bridges)_00","STP","60","RST. Root = 32768/0/c4:ad:34:1c:9f:51  Cost = 0  Port = 0x0001"
"42","10.010450446","Routerbo_1c:9f:51","Spanning-tree-(for-bridges)_00","STP","60","RST. Root = 32768/0/c4:ad:34:1c:9f:51  Cost = 0  Port = 0x0001"
"43","12.011781142","Routerbo_1c:9f:51","Spanning-tree-(for-bridges)_00","STP","60","RST. Root = 32768/0/c4:ad:34:1c:9f:51  Cost = 0  Port = 0x0001"
"44","12.467908663","Netronix_50:3f:2c","EdimaxTe_ee:0e:93","ARP","60","Who has 172.16.30.1? Tell 172.16.30.254"
"45","12.467928568","EdimaxTe_ee:0e:93","Netronix_50:3f:2c","ARP","42","172.16.30.1 is at 00:50:fc:ee:0e:93"
"46","14.014564358","Routerbo_1c:9f:51","Spanning-tree-(for-bridges)_00","STP","60","RST. Root = 32768/0/c4:ad:34:1c:9f:51  Cost = 0  Port = 0x0001"
